{
  "publishedBy": "platform-observability",
  "publishedAt": "2026-06-06T22:10:00+08:00",
  "checksumSha256": "f33bb8891eef59747252ae11d5b5b3fb6853cdbc757638a39a3609b140caa423",
  "signatureAlgorithm": "HmacSHA256",
  "signature": "cd9229207dbae254d855a961486485e5deaf4ba1dffd0dc50e60ac5012460b43"
}
