{
  "publishedBy": "platform-observability",
  "publishedAt": "2026-06-06T23:20:00+08:00",
  "checksumSha256": "bee0bc4bcb5cfa0a332d46b04861b15bc36a03f6b92db8a8988af4a10f1c9e97",
  "signatureAlgorithm": "HmacSHA256",
  "signature": "b8932ca9baea8da05cb9c20c21017382131273ba72f7fd7f395d5bb831b66853"
}
